[
  {
    "receiptNumber": 1416712,
    "receiptPosition": 1,
    "date": "2021-12-09T00:00:00",
    "id": "91d52bfe-f57e-5cb9-8c14-007038fbb358",
    "cashRegisterNumber": 1,
    "staffNumber": 999,
    "status": 100,
    "amount": 154.2,
    "branchNumber": 1,
    "customerNumber": 1113,
    "currencyNumber": "EUR",
    "invoiceDate": "2021-12-09T00:00:00",
    "number": 1,
    "lastChange": "2023-12-05T13:37:28.6849231",
    "isDeleted": false
  },
  {
    "receiptNumber": 1000512,
    "receiptPosition": 1,
    "date": "2004-02-17T00:00:00",
    "id": "2460a71f-1cdb-4289-8392-00813fe74d3b",
    "cashRegisterNumber": 1,
    "staffNumber": 999,
    "status": 100,
    "amount": -1.0,
    "branchNumber": 1,
    "customerNumber": 10000,
    "currencyNumber": "EUR",
    "invoiceDate": "2004-02-17T00:00:00",
    "number": 1,
    "lastChange": "2019-10-22T20:12:27.8487197",
    "isDeleted": false
  },
  {
    "receiptNumber": 1000122,
    "receiptPosition": 1,
    "date": "2004-02-12T00:00:00",
    "id": "83dec711-a758-46de-afdc-0091d5a036db",
    "cashRegisterNumber": 1,
    "staffNumber": 999,
    "status": 100,
    "amount": 10.0,
    "branchNumber": 1,
    "customerNumber": 12020400,
    "currencyNumber": "EUR",
    "invoiceDate": "2004-02-12T00:00:00",
    "number": 1,
    "lastChange": "2019-10-22T20:12:27.8487197",
    "isDeleted": false
  },
  {
    "receiptNumber": 1420892,
    "receiptPosition": 1,
    "date": "2022-02-22T00:00:00",
    "id": "9a98cc37-309a-38bb-9114-04081ce9388e",
    "cashRegisterNumber": 1,
    "staffNumber": 999,
    "status": 100,
    "amount": 5.0,
    "branchNumber": 1,
    "customerNumber": 1015806,
    "currencyNumber": "EUR",
    "invoiceDate": "2022-02-22T00:00:00",
    "number": 1,
    "lastChange": "2023-12-05T13:37:28.6849231",
    "isDeleted": false
  },
  {
    "receiptNumber": 1425610,
    "receiptPosition": 1,
    "date": "2022-06-20T00:00:00",
    "id": "e52dc48c-eb4b-2d91-9814-0447c48b9fdc",
    "cashRegisterNumber": 1,
    "staffNumber": 999,
    "status": 100,
    "amount": 291.4,
    "branchNumber": 1,
    "customerNumber": 1010702,
    "currencyNumber": "EUR",
    "invoiceDate": "2022-06-20T00:00:00",
    "number": 1,
    "lastChange": "2023-12-05T13:37:28.6849231",
    "isDeleted": false
  },
  {
    "receiptNumber": 1000539,
    "receiptPosition": 1,
    "date": "2004-02-17T00:00:00",
    "id": "3187418e-10f2-4de9-b618-0550592bb287",
    "cashRegisterNumber": 1,
    "staffNumber": 999,
    "status": 100,
    "amount": -10.0,
    "branchNumber": 1,
    "customerNumber": 10000,
    "currencyNumber": "EUR",
    "invoiceDate": "2004-02-17T00:00:00",
    "number": 1,
    "lastChange": "2019-10-22T20:12:27.8487197",
    "isDeleted": false
  },
  {
    "receiptNumber": 1408392,
    "receiptPosition": 2,
    "date": "2021-07-02T00:00:00",
    "id": "a9b42f0c-714b-f18f-8214-059e3db5fc50",
    "cashRegisterNumber": 1,
    "staffNumber": 999,
    "status": 100,
    "amount": 19.99,
    "branchNumber": 1,
    "customerNumber": 1009116,
    "currencyNumber": "EUR",
    "invoiceDate": "2021-07-02T00:00:00",
    "number": 1,
    "lastChange": "2023-12-05T13:37:28.6849231",
    "isDeleted": false
  },
  {
    "receiptNumber": 1340876,
    "receiptPosition": 1,
    "date": "2017-11-29T00:00:00",
    "id": "9c90bac5-2e63-4bbf-aa24-070b4df4f3d5",
    "cashRegisterNumber": 1,
    "staffNumber": 999,
    "status": 100,
    "amount": 22.8,
    "branchNumber": 1,
    "customerNumber": 1009584,
    "currencyNumber": "EUR",
    "invoiceDate": "2017-11-29T00:00:00",
    "number": 1,
    "lastChange": "2023-12-05T13:37:28.6849231",
    "isDeleted": false
  },
  {
    "receiptNumber": 1448310,
    "receiptPosition": 1,
    "date": "2023-10-04T00:00:00",
    "id": "c60d79b7-0e75-e9b0-b514-073320adb01f",
    "cashRegisterNumber": 1,
    "staffNumber": 999,
    "status": 100,
    "amount": 5.0,
    "branchNumber": 1,
    "customerNumber": 2016255,
    "currencyNumber": "EUR",
    "invoiceDate": "2023-10-04T00:00:00",
    "number": 1,
    "lastChange": "2023-12-05T13:37:28.6849231",
    "isDeleted": false
  },
  {
    "receiptNumber": 1000589,
    "receiptPosition": 1,
    "date": "2004-02-18T00:00:00",
    "id": "188f67bc-8d4f-48a6-ae2c-0753d941e37c",
    "cashRegisterNumber": 1,
    "staffNumber": 999,
    "status": 100,
    "amount": -500.0,
    "branchNumber": 1,
    "customerNumber": 10000,
    "currencyNumber": "EUR",
    "invoiceDate": "2004-02-18T00:00:00",
    "number": 1,
    "lastChange": "2019-10-22T20:12:27.8487197",
    "isDeleted": false
  },
  {
    "receiptNumber": 1002638,
    "receiptPosition": 1,
    "date": "2004-03-20T00:00:00",
    "id": "8be88a90-40cd-4dec-bae8-084a43859c09",
    "cashRegisterNumber": 1,
    "staffNumber": 999,
    "status": 100,
    "amount": 7.85,
    "branchNumber": 1,
    "customerNumber": 8075000,
    "currencyNumber": "EUR",
    "invoiceDate": "2004-03-20T00:00:00",
    "number": 1,
    "lastChange": "2019-10-22T20:12:27.8487197",
    "isDeleted": false
  },
  {
    "receiptNumber": 10302772,
    "receiptPosition": 2,
    "date": "2022-07-01T00:00:00",
    "id": "ee6c8bc6-667a-0292-9814-0bf3b8e2d9e9",
    "cashRegisterNumber": 10,
    "staffNumber": 999,
    "status": 100,
    "amount": 210.94,
    "branchNumber": 1,
    "customerNumber": 2190733,
    "currencyNumber": "EUR",
    "invoiceDate": "2022-07-01T00:00:00",
    "number": 1,
    "lastChange": "2023-12-05T13:37:28.6849231",
    "isDeleted": false
  },
  {
    "receiptNumber": 1447020,
    "receiptPosition": 1,
    "date": "2023-09-18T00:00:00",
    "id": "ff08b762-0022-fab5-b414-0c34f4a9a86a",
    "cashRegisterNumber": 1,
    "staffNumber": 999,
    "status": 100,
    "amount": 20.05,
    "branchNumber": 1,
    "customerNumber": 2001218,
    "currencyNumber": "EUR",
    "invoiceDate": "2023-09-18T00:00:00",
    "number": 1,
    "lastChange": "2023-12-05T13:37:28.6849231",
    "isDeleted": false
  },
  {
    "receiptNumber": 1348794,
    "receiptPosition": 1,
    "date": "2018-02-22T00:00:00",
    "id": "4e84a54f-80a8-4150-8e55-0db02dbe1562",
    "cashRegisterNumber": 1,
    "staffNumber": 999,
    "status": 100,
    "amount": 5.0,
    "branchNumber": 1,
    "customerNumber": 18168000,
    "currencyNumber": "EUR",
    "invoiceDate": "2018-02-22T00:00:00",
    "number": 1,
    "lastChange": "2023-12-05T13:37:28.6849231",
    "isDeleted": false
  },
  {
    "receiptNumber": 1406757,
    "receiptPosition": 1,
    "date": "2021-06-01T00:00:00",
    "id": "94048407-9b11-8f89-8014-0eb290a08121",
    "cashRegisterNumber": 1,
    "staffNumber": 999,
    "status": 100,
    "amount": 139.8,
    "branchNumber": 1,
    "customerNumber": 1213,
    "currencyNumber": "EUR",
    "invoiceDate": "2021-06-01T00:00:00",
    "number": 1,
    "lastChange": "2023-12-05T13:37:28.6849231",
    "isDeleted": false
  },
  {
    "receiptNumber": 1453611,
    "receiptPosition": 1,
    "date": "2024-01-02T00:00:00",
    "id": "dc6237fa-a650-0fb6-ba14-10b8c0f8f226",
    "cashRegisterNumber": 1,
    "staffNumber": 999,
    "status": 100,
    "amount": 294.65,
    "branchNumber": 1,
    "customerNumber": 4191000,
    "currencyNumber": "EUR",
    "invoiceDate": "2024-01-02T00:00:00",
    "number": 1,
    "lastChange": "2024-11-19T08:34:23.1308929",
    "isDeleted": false
  },
  {
    "receiptNumber": 1404317,
    "receiptPosition": 1,
    "date": "2020-11-27T00:00:00",
    "id": "dc9f7778-5cf4-cab7-7514-1349a05dc863",
    "cashRegisterNumber": 1,
    "staffNumber": 999,
    "status": 100,
    "amount": 23.63,
    "branchNumber": 1,
    "customerNumber": 1013764,
    "currencyNumber": "EUR",
    "invoiceDate": "2020-11-27T00:00:00",
    "number": 1,
    "lastChange": "2023-12-05T13:37:28.6849231",
    "isDeleted": false
  },
  {
    "receiptNumber": 1386355,
    "receiptPosition": 1,
    "date": "2019-11-25T00:00:00",
    "id": "aedb2a17-5c5f-e1a2-5e14-14b3d8e1a525",
    "cashRegisterNumber": 1,
    "staffNumber": 999,
    "status": 100,
    "amount": 149.0,
    "branchNumber": 1,
    "customerNumber": 16011810,
    "currencyNumber": "EUR",
    "invoiceDate": "2019-11-25T00:00:00",
    "number": 1,
    "lastChange": "2023-12-05T13:37:28.6849231",
    "isDeleted": false
  },
  {
    "receiptNumber": 1364745,
    "receiptPosition": 2,
    "date": "2018-12-10T00:00:00",
    "id": "170bb1e9-ace5-4813-bac6-159f9e950bb9",
    "cashRegisterNumber": 1,
    "staffNumber": 999,
    "status": 100,
    "amount": 54.34,
    "branchNumber": 1,
    "customerNumber": 1132,
    "currencyNumber": "EUR",
    "invoiceDate": "2018-12-10T00:00:00",
    "number": 1,
    "lastChange": "2023-12-05T13:37:28.6849231",
    "isDeleted": false
  },
  {
    "receiptNumber": 1322608,
    "receiptPosition": 1,
    "date": "2017-01-03T00:00:00",
    "id": "880afc1d-ca1d-4b5f-aa3f-15a30c3f46dd",
    "cashRegisterNumber": 1,
    "staffNumber": 999,
    "status": 100,
    "amount": 21.05,
    "branchNumber": 1,
    "customerNumber": 8066070,
    "currencyNumber": "EUR",
    "invoiceDate": "2017-01-03T00:00:00",
    "number": 1,
    "lastChange": "2023-12-05T13:37:28.6849231",
    "isDeleted": false
  },
  {
    "receiptNumber": 1408176,
    "receiptPosition": 1,
    "date": "2021-06-30T00:00:00",
    "id": "a54b3231-64b2-b0b4-8214-177aacabae36",
    "cashRegisterNumber": 1,
    "staffNumber": 999,
    "status": 100,
    "amount": 339.76,
    "branchNumber": 1,
    "customerNumber": 1127,
    "currencyNumber": "EUR",
    "invoiceDate": "2021-06-30T00:00:00",
    "number": 1,
    "lastChange": "2023-12-05T13:37:28.6849231",
    "isDeleted": false
  },
  {
    "receiptNumber": 1467848,
    "receiptPosition": 1,
    "date": "2025-01-09T00:00:00",
    "id": "9b65317d-1491-b683-d114-199fdcf2af51",
    "cashRegisterNumber": 1,
    "staffNumber": 999,
    "status": 0,
    "amount": 12.25,
    "branchNumber": 1,
    "customerNumber": 2001218,
    "currencyNumber": "EUR",
    "invoiceDate": "2025-01-09T00:00:00",
    "number": 1,